<?xml version="1.0" encoding="utf-8"?>
<xs:schema xmlns:xs="http://www.w3.org/2001/XMLSchema"
	targetNamespace="http://www.uniovi.es"
	xmlns="http://www.uniovi.es"
	elementFormDefault="qualified">	
	<xs:element name="circuito">
		<xs:complexType>
			<xs:sequence>
				<xs:element ref="nombre" />
				<xs:element ref="caracteristicas" />
				<xs:element ref="referencias" />
				<xs:element ref="fotografias" />
				<xs:element ref="videos" />
				<xs:element ref="coordenadas" />
				<xs:element ref="puntos_circuito" />
			</xs:sequence>
		</xs:complexType>
	</xs:element>
	<xs:element name="nombre" type="xs:string" />
	<xs:element name="caracteristicas">
		<xs:complexType>
			<xs:sequence>
				<xs:element minOccurs="1" maxOccurs="unbounded" ref="dato" />
			</xs:sequence>
		</xs:complexType>
	</xs:element>
	<xs:element name="dato">
		<xs:complexType>
			<xs:simpleContent>
				<xs:extension base="xs:string">
					<xs:attribute name="valor" type="xs:string" use="required" />
				</xs:extension>
			</xs:simpleContent>
		</xs:complexType>
	</xs:element>
	<xs:element name="referencias">
		<xs:complexType>
			<xs:sequence>
				<xs:element minOccurs="1" maxOccurs="unbounded" ref="referencia" />
			</xs:sequence>
		</xs:complexType>
	</xs:element>
	<xs:element name="referencia">
		<xs:complexType>
			<xs:simpleContent>
				<xs:extension base="xs:string">
					<xs:attribute name="enlace" type="xs:string" use="required" />
				</xs:extension>
			</xs:simpleContent>
		</xs:complexType>
	</xs:element>
	<xs:element name="fotografias">
		<xs:complexType>
			<xs:sequence>
				<xs:element minOccurs="1" maxOccurs="5" ref="fotografia" />
			</xs:sequence>
		</xs:complexType>
	</xs:element>
	<xs:element name="videos">
		<xs:complexType>
			<xs:sequence>
				<xs:element minOccurs="0" maxOccurs="3" ref="video" />
			</xs:sequence>
		</xs:complexType>
	</xs:element>
	<xs:element name="fotografia">
		<xs:complexType>
			<xs:sequence>
				<xs:element ref="title" />
				<xs:element ref="altText" />
			</xs:sequence>
			<xs:attribute name="referencia" type="xs:string" use="required" />
		</xs:complexType>
	</xs:element>
	<xs:element name="video">
		<xs:complexType>
			<xs:sequence>
				<xs:element ref="title" />
				<xs:element ref="format" />
			</xs:sequence>
			<xs:attribute name="referencia" type="xs:string" use="required" />
		</xs:complexType>
	</xs:element>
	<xs:element name="title" type="xs:string" />
	<xs:element name="altText" type="xs:string" />
	<xs:element name="format" type="xs:string" />
	<xs:element name="coordenadas">
		<xs:complexType>
			<xs:sequence>
				<xs:element ref="longitud" />
				<xs:element ref="latitud" />
				<xs:element ref="altitud" />
			</xs:sequence>
		</xs:complexType>
	</xs:element>
	<xs:element name="longitud">
		<xs:complexType>
			<xs:simpleContent>
				<xs:extension base="xs:string">
					<xs:attribute name="valor" type="longitudType" use="required" />
				</xs:extension>
				
			</xs:simpleContent>
		</xs:complexType>
	</xs:element>
	<xs:element name="latitud">
		<xs:complexType>
			<xs:simpleContent>
				<xs:extension base="xs:string">
					<xs:attribute name="valor" type="latitudeType" use="required" />
				</xs:extension>
			</xs:simpleContent>
		</xs:complexType>
	</xs:element>
	<xs:element name="altitud">
		<xs:complexType>
			<xs:simpleContent>
				<xs:extension base="xs:string">
					<xs:attribute name="valor" type="altitudType" use="required" />
				</xs:extension>
			</xs:simpleContent>
		</xs:complexType>
	</xs:element>

	<xs:simpleType name="latitudeType">
		<xs:restriction base="xs:decimal">
			<xs:minInclusive value="-90"/>  
			<xs:maxInclusive value="90"/>
		</xs:restriction>
	</xs:simpleType>
	
	<xs:simpleType name="longitudType">
		<xs:restriction base="xs:decimal">
			<xs:minInclusive value="-180"/> 
			<xs:maxInclusive value="180"/>
		</xs:restriction>
	</xs:simpleType>

	<xs:simpleType name="altitudType">
		<xs:restriction base="xs:decimal">
			<xs:minInclusive value="-50"/> 
			<xs:maxInclusive value="5000"/>
		</xs:restriction>
	</xs:simpleType>

	<xs:element name="puntos_circuito">
		<xs:complexType>
			<xs:sequence>
				<xs:element minOccurs="1" maxOccurs="unbounded" ref="punto" />
			</xs:sequence>
		</xs:complexType>
	</xs:element>
	<xs:element name="punto">
		<xs:complexType>
			<xs:sequence>
				<xs:element ref="distancia_del_tramo" />
				<xs:element ref="coordenadas" />
				<xs:element ref="numero_sector" />
				<xs:element ref="descripcion" />
			</xs:sequence>
		</xs:complexType>
	</xs:element>
	<xs:element name="distancia_del_tramo">
		<xs:complexType>
			<xs:sequence>
				<xs:element ref="valor" />
				<xs:element ref="unidades" />
			</xs:sequence>
		</xs:complexType>
	</xs:element>
	<xs:element name="valor" type="xs:integer" />
	<xs:element name="unidades" type="xs:string" />
	<xs:element name="numero_sector" type="xs:integer" />
	<xs:element name="descripcion" type="xs:string" />
</xs:schema>